{
  "version": 0.6,
  "generator": "Overpass API 0.7.62.7 375dc00a",
  "osm3s": {
    "timestamp_osm_base": "2025-07-13T15:04:45Z",
    "copyright": "The data included in this document is from www.openstreetmap.org. The data is made available under ODbL."
  },
  "elements": [

{
  "type": "node",
  "id": 242181605,
  "lat": 22.0000000,
  "lon": 33.4130560
},
{
  "type": "node",
  "id": 242186389,
  "lat": 21.7250000,
  "lon": 33.5529167
},
{
  "type": "node",
  "id": 242206885,
  "lat": 22.0000000,
  "lon": 33.1666667
},
{
  "type": "node",
  "id": 242206891,
  "lat": 22.0000210,
  "lon": 34.0798633
},
{
  "type": "node",
  "id": 2542289902,
  "lat": 21.8705099,
  "lon": 33.7372116,
  "tags": {
    "alt_name": "بيرطويل;بير طويل",
    "alt_name:ar": "بيرطويل;بير طويل",
    "alt_name:en": "Bi'r Tawīl",
    "description": "إقليم لم يطالب به أي بلد.",
    "description:ar": "إقليم لم يطالب به أي بلد.",
    "description:de": "Gebiet, das von keinem Land beansprucht wird",
    "description:en": "Territory unclaimed by any country",
    "description:es": "Territorio no reclamado por ningún país",
    "name": "بئر طويل",
    "name:ar": "بئر طويل",
    "name:de": "Bir Tawil",
    "name:el": "Μπιρ Ταουίλ",
    "name:en": "Bir Tawil",
    "name:es": "Bir Tawil",
    "name:fa": "بئر طویل",
    "name:fr": "Bir Tawil",
    "name:hy": "Բիր-Տավիլ",
    "name:pt": "Bir Tawil",
    "name:ru": "Бир-Тавиль",
    "name:zh": "比尔泰维勒/比爾泰維勒",
    "name:zh-Hans": "比尔泰维勒",
    "name:zh-Hant": "比爾泰維勒",
    "place": "region",
    "wikidata": "Q620634",
    "wikipedia": "ar:بئر طويل"
  }
},
{
  "type": "node",
  "id": 2615199944,
  "lat": 21.7666667,
  "lon": 34.0000000,
  "tags": {
    "alt_name": "بئر حسمة عمر",
    "int_name": "Bîr Hismet ‘Umar, Bir Hismet Umar",
    "name": "بئر حسمة عمر",
    "name:ar": "بئر حسمة عمر",
    "name:ar1": "بئر حسمة عمر",
    "name:de": "Bir Hismet Umar",
    "name:en": "Bir Hismet Umar",
    "name:fr": "Bir Hismet Umar",
    "natural": "spring"
  }
},
{
  "type": "way",
  "id": 22587325,
  "nodes": [
    242206885,
    242186389
  ],
  "tags": {
    "admin_level": "2",
    "border_type": "nation",
    "boundary": "administrative",
    "disputed": "yes",
    "left:country": "بئر طويل",
    "name": "السودان - بئر طويل",
    "name:ar": "السودان - بئر طويل",
    "name:de": "Sudan - Bir Tawil",
    "name:en": "Sudan - Bir Tawil",
    "name:es": "Sudán - Bir Tawil",
    "name:fr": "Soudan - Bir Tawil",
    "right:country": "السودان",
    "source": "CIA World database II",
    "wdb:source": "CIA World database II - africa-bdy.txt - segment 5"
  }
},
{
  "type": "way",
  "id": 255823727,
  "nodes": [
    242181605,
    242206885
  ],
  "tags": {
    "admin_level": "2",
    "attribution": "US Dept. of State Office of the Geographer",
    "border_type": "nation",
    "boundary": "administrative",
    "disputed": "yes",
    "left:country": "بئر طويل",
    "name": "مصر - بئر طويل",
    "name:ar": "مصر - بئر طويل",
    "name:de": "Ägypten - Bir Tawil",
    "name:en": "Egypt - Bir Tawil",
    "name:es": "Egipto - Bir Tawil",
    "name:fr": "Égypte - Bir Tawil",
    "right:country": "مصر",
    "source": "Large Scale International Boundary (US DoS/INR/GGI-06/2013)",
    "source:date": "2013-06"
  }
},
{
  "type": "way",
  "id": 255823728,
  "nodes": [
    242206891,
    242181605
  ],
  "tags": {
    "admin_level": "2",
    "attribution": "US Dept. of State Office of the Geographer",
    "border_type": "nation",
    "boundary": "administrative",
    "disputed": "yes",
    "left:country": "بئر طويل",
    "name": "مصر - بئر طويل",
    "name:ar": "مصر - بئر طويل",
    "name:de": "Ägypten - Bir Tawil",
    "name:en": "Egypt - Bir Tawil",
    "name:es": "Egipto - Bir Tawil",
    "name:fr": "Égypte - Bir Tawil",
    "right:country": "مصر",
    "source": "Large Scale International Boundary (US DoS/INR/GGI-06/2013)",
    "source:date": "2013-06"
  }
},
{
  "type": "way",
  "id": 284530551,
  "nodes": [
    242186389,
    2615199944,
    242206891
  ],
  "tags": {
    "admin_level": "2",
    "border_type": "nation",
    "boundary": "administrative",
    "disputed": "yes",
    "left:country": "بئر طويل",
    "name": "السودان - بئر طويل",
    "name:ar": "السودان - بئر طويل",
    "name:de": "Sudan - Bir Tawil",
    "name:en": "Sudan - Bir Tawil",
    "name:es": "Sudán - Bir Tawil",
    "name:fr": "Soudan - Bir Tawil",
    "right:country": "السودان",
    "source": "CIA World database II",
    "wdb:source": "CIA World database II - africa-bdy.txt - segment 5"
  }
},
{
  "type": "relation",
  "id": 3335661,
  "members": [
    {
      "type": "way",
      "ref": 255823728,
      "role": "outer"
    },
    {
      "type": "way",
      "ref": 255823727,
      "role": "outer"
    },
    {
      "type": "way",
      "ref": 22587325,
      "role": "outer"
    },
    {
      "type": "way",
      "ref": 284530551,
      "role": "outer"
    },
    {
      "type": "node",
      "ref": 2542289902,
      "role": "label"
    }
  ],
  "tags": {
    "alt_name": "بيرطويل;بير طويل",
    "alt_name:ar": "بيرطويل;بير طويل",
    "alt_name:en": "Bi'r Tawīl",
    "boundary": "political",
    "description": "إقليم لم يطالب به أي بلد.",
    "description:ar": "إقليم لم يطالب به أي بلد.",
    "description:de": "Gebiet, das von keinem Land beansprucht wird.",
    "description:en": "Territory unclaimed by any country.",
    "description:es": "Territorio no reclamado por ningún país.",
    "name": "بئر طويل",
    "name:ar": "بئر طويل",
    "name:de": "Bir Tawil",
    "name:el": "Μπιρ Ταουίλ",
    "name:en": "Bir Tawil",
    "name:es": "Bir Tawil",
    "name:fa": "بئر طویل",
    "name:fr": "Bir Tawil",
    "name:hy": "Բիր-Տավիլ",
    "name:pt": "Bir Tawil",
    "name:ru": "Бир-Тавиль",
    "name:uk": "Бір-Тавіль",
    "name:zh": "比尔泰维勒/比爾泰維勒",
    "name:zh-Hans": "比尔泰维勒",
    "name:zh-Hant": "比爾泰維勒",
    "place": "region",
    "timezone": "Africa/Cairo",
    "type": "boundary",
    "wikidata": "Q620634",
    "wikipedia": "ar:بئر طويل"
  }
}

  ]
}
